Type,Description,Image Path
flying,"flying type, eagle-like, dark brown feathers, golden-feathered head, sharp black talons, hooked yellow beak, piercing blue eyes, white tail feathers, broad wingspan.",image_2/flying/23_5.png
flying,"flying type, falcon-like, slate-gray feathers, white underbelly, sharp yellow eyes, black streaks around the eyes, hooked gray beak, taloned feet, banded wings with black tips.",image_2/flying/24_3.png
flying,"falcon-like, sleek body, sharp silver feathers, cream-colored underbelly, dark markings around eyes, pointed gray beak, four-toed talons, piercing yellow eyes with a faint blue ring around them.",image_2/flying/25_2.png
flying,"flying type, falcon-like, sleek golden-brown feathers, cream-colored chest, sharp yellow beak, dark talons, piercing amber eyes with a dark streak above, banded tail with tan and dark brown stripes.",image_2/flying/26_4.png
flying,"flying type, falcon-like, brown feathers, cream-colored underbelly, sharp black markings along wings, yellow beak with a hooked tip, taloned feet, piercing yellow eyes with a fierce glare.",image_2/flying/27_1.png
flying,"Flying type, hawk-like, dark brown feathers, cream-colored underbelly, sharp yellow beak, talon-like feet with four toes, golden eyes with a black band across the face.",image_2/flying/28_3.png
flying,"flying type, hawk-like, bronze feathers, cream-colored underbelly, gold streaks around wings, sharp yellow beak, talons with four claws, piercing green eyes with black markings above.",image_2/flying/29_4.png
flying,"flying type, owl-like, bronze feathers, cream-colored breast feathers, golden mask around face, sharp gray beak, short talons, piercing yellow eyes with dark circles around them.",image_2/flying/30_2.png
ice,"ice type, medium-sized, white, round body resembling a snowball, pointed icicle spikes on head and back, two large round eyes with blue irises, chilly breath, slides gracefully on snow, short arms ending in three icy claws.",image_2/ice/1_2.png
ice,"Ice type, small, light purple, smooth spherical body with frost-like patterns, four-dot pattern on face, chilling wind surrounds it, floats gracefully without legs, two triangular ice shard arms.",image_2/ice/2_5.png
ice,"ice type, medium-sized, white, swirling mist-like body, icy blue eyes, cool breeze emanating, floats in air, twisting icy tendrils, two pointed crystal horns.",image_2/ice/3_5.png
ice,"ice type, small, white, smooth round body with frosty texture, diamond-shaped eyes, whimsical snowflake antennae, gives off a gentle chill, floats gracefully in the air, tiny star-shaped hands.",image_2/ice/4_4.png
ice,"ice type, medium-sized, light gray, rounded snowball-like body, glowing blue eyes, gentle snowfall emitted, slides effortlessly on icy terrain, has two stubby arms with mittens, single pointed tail.",image_2/ice/5_5.png
ice,"Entry example: ice type, small, white, round snowball-like body, two dot pattern on face, chilly aura, rolls instead of walking, no visible fingers or toes.",image_2/ice/6_2.png
ice,"small, white, round body, snowflake-like appendages, two-dot pattern on face, chilly breeze emanates from its body, floats effortlessly in the air, two pointed icicle arms.",image_2/ice/7_2.png
ice,"ice type, medium-sized, white, snowball-like body, two small antlers made of ice, permanent snowfall surrounds it, rolls around with ease, two fluffy hand-like appendages with icy claws.",image_2/ice/8_2.png
ice,"snowflake motif, icy white, delicate crystalline formations, four-dot pattern on face, frigid mist emanates, floats gently in the air, two elongated arms with pointed ends.",image_2/ice/9_5.png
ice,"ice type, medium-sized, light blue, smooth rounded body with snowflake-like patterns, four-dot pattern on face, chilly mist surrounds it, glides over icy surfaces, two mitten-shaped hands.",image_2/ice/10_5.png
ice,"ice type, medium-sized, white with pale blue patches, fluffy and snow-like texture, serene expression with small eyes, gently glows in cold settings, glides smoothly on powdery snow, four round paws with icy pads.",image_2/ice/11_5.png
ice,"small, white, smooth snowball-like body, single blue crystal horn on forehead, swirling dot pattern on cheeks, constant chilly breeze surrounding it, balances on spherical base, tiny icicle fingers.",image_2/ice/12_3.png
ice,"Ice type, medium-sized, white, fluffy snow-covered coat, sparkling ice shards adorning its back, gentle and soothing ice-blue eyes, radiates a calming chill, stands gracefully on slender icicle-like legs, delicate frost-covered wings.",image_2/ice/13_1.png
ice,"ice type, medium-sized, sleek, smooth snow-white fur, rounded ears with icicle tips, three icy blue stripes on back, emits chilly breeze, glides on snow with ease, four sharp clawed paws.",image_2/ice/14_1.png
ice,"ice type, small, white, round ice-like body, four-dot pattern on forehead, frosty mist emanates from body, glides on spherical feet, two stubby triangular arms.",image_2/ice/15_1.png
ice,"ice type, medium-sized, white, smooth round body, four blue diamond patterns on its back, frosty breath, slides on a flat base, two slender arms with circular mittens.",image_2/ice/16_3.png
ice,"ice type, small, white, smooth round body, shimmering snowflakes on face, chilly mist envelops it, glides effortlessly on icy terrain, no visible arms but emits a soft glow.",image_2/ice/17_4.png
ice,"Ice type, medium-sized, pale turquoise, soft fur resembling icicles, sparkling snowflakes pattern on back, emits a frosty mist, glides on smooth, icy surfaces, four rounded, clawed paws.",image_2/ice/18_2.png
ice,"ice type, small, pale white, round snowball-like body, a pair of small black eyes in a triangular pattern, frosty mist surrounding it, glides gently using flat, disc-like feet, two slender icicle arms.",image_2/ice/19_4.png
ice,"Ice type, medium-sized, silver-white, glistening icicle features, smooth diamond pattern down back, emits a frosty mist, gracefully slides on a flat base, two elongated hexagonal arms with sharp tips.",image_2/ice/20_3.png
ice,"ice type, small, white, round body covered in snow-like fur, bright blue eyes, icy breath, travels on four tiny paws, two pointed ears.",image_2/ice/21_4.png
ice,"Ice type, medium-sized, white, snow-covered fur, icicle-like antennae on its head, frost patterns on its back, emits a chilly breeze, moves silently on padded feet, has two clawed fingers.",image_2/ice/22_3.png
ice,"ice type, elegant, pale turquoise, flowing icy mane, sparkling frost covering skin, piercing icy gaze, gracefully skating on frozen surfaces, delicate frost-covered antlers, ribbon-like appendages cascading down its back.",image_2/ice/23_4.png
ice,"ice type, medium-sized, pale white, swirling snowflake-like structures, embedded sapphire-like core, frosty mist surrounding body, glides on a flat base, fine needle-like appendages.",image_2/ice/24_3.png
ice,"ice type, small, white, round snowball-like body, two-dot pattern on face, chilly breeze around it, floats gently above the ground, stubby arms with mitten-like hands.",image_2/ice/25_3.png
ice,"ice type, medium-sized, white with a translucent sheen, swirling snowflake patterns across its body, frost-covered antlers, emits a chilly breeze, hovers slightly above the ground, pointed icicle-like tail.",image_2/ice/26_4.png
ice,"ice type, medium-sized, white, smooth surface with a glossy sheen, hexagonal snowflake patterns on body, emits a chilling breeze, hovers slightly above the ground, delicate filament-like arms, two pointed icicle-like legs.",image_2/ice/27_5.png
ice,"ice type, medium-sized, white and silver, round body with frosty texture, three icicle-like horns on its head, crystalline blue eyes, emits freezing mist, glides on smooth ice slides, two long icicle arms ending in snowflake",image_2/ice/28_1.png
ice,"ice type, medium-sized, white, sleek and smooth with icicle-like appendages, glistening icy patterns along its body, chilling presence, slides gracefully on icy surfaces, two thin arms ending in sharp icy claws.",image_2/ice/29_3.png
ice,"ice type, small, pale white, smooth shell-like body, three icy spikes on top of head, mist surrounds its form, moves by gliding silently, two sharp icicle arms.",image_2/ice/30_4.png
dragon,"Dragon type, majestic, emerald green, serpentine body, piercing golden eyes, luminescent scales, whiskers flowing like ribbons, delicate feathered wings, long sinuous tail, ornate silver horns.",image_2/dragon/1_3.png
dragon,"dragon type, medium-sized, emerald green, serpentine, piercing yellow eyes, smooth scales, elongated whiskers, small wings, razor-sharp silver fangs, flexible tail.",image_2/dragon/2_3.png
dragon,"dragon type, massive, black, serpentine, glowing yellow eyes, jagged scales along body, expansive wings, razor-like silver claws, long whip-like tail.",image_2/dragon/3_3.png
dragon,"dragon type, medium-sized, emerald green, serpentine, glowing yellow eyes, smooth scales, long slender body, small wings, sharp black claws, whip-like tail.",image_2/dragon/4_3.png
dragon,"Dragon type, medium, green, serpentine, glowing yellow eyes, elegant golden scales, elongated body, feathered tail, slender wings, sharp black horns.",image_2/dragon/5_3.png
dragon,"dragon type, medium-sized, emerald green, serpentine, menacing yellow eyes, jagged scales on body, elongated wings, pointed black horns, sinuous tail, clawed feet.",image_2/dragon/6_3.png
dragon,"Dragon type, medium-sized, emerald green, serpentine, intimidating black horns, smooth scales on body, large leathery wings, razor-like silver talons, slender whip-like tail.",image_2/dragon/7_4.png
dragon,"sleek, dragon type, medium-sized, emerald green, serpentine, radiant gold horns, smooth scales, elongated wings, razor-sharp talons, slender tail.",image_2/dragon/8_3.png
dragon,"emerald green body, dragon type, majestic, serpentine, golden mane, long whiskers, large curved horns, shimmering scales, narrow wings, piercing yellow eyes, slender tail with a flared tip, razor-sharp talons.",image_2/dragon/9_5.png
dragon,"Dragon type, towering, green, serpentine, piercing yellow eyes, jagged scales on back, massive wingspan, curved black horns, lengthy barbed tail.",image_2/dragon/10_4.png
dragon,"dragon type, large, emerald green, serpentine, shimmering gold eyes, jagged scales along back, expansive membranous wings, razor-edged black talons, long sinuous tail.",image_2/dragon/11_1.png
dragon,"dragon type, medium-sized, emerald green, serpentine body, blazing orange head, jagged fins on back, broad membranous wings, gleaming silver talons, slender coiled tail.",image_2/dragon/12_4.png
dragon,"Dragon type, massive, emerald green, serpentine, blazing orange eyes, jagged scales along the spine, expansive leathery wings, glinting silver fangs, long sinuous tail.",image_2/dragon/13_1.png
dragon,"Dragon type, medium-sized, green, serpentine, emerald eyes, flowing golden mane, slender wings, gleaming ivory fangs, slender tail.",image_2/dragon/14_5.png
dragon,"dragon type, massive, emerald green, serpentine, glowing yellow eyes, jagged scales along body, expansive wings, obsidian black horns, long slender tail.",image_2/dragon/15_4.png
dragon,"dragon type, small, emerald green, serpentine, gentle violet eyes, smooth scales on body, delicate transparent wings, slender silver horns, flowing tail.",image_2/dragon/16_4.png
dragon,"dragon type, small, green, serpentine, elegant silver scales, feathered crest on head, winding body, delicate wings, amber talons, slender tail.",image_2/dragon/17_4.png
dragon,"dragon type, small, emerald green, serpentine, glowing golden eyes, smooth scales on body, long narrow wings, nimble silver claws, slender tail",image_2/dragon/18_4.png
dragon,"Entry example: dragon type, massive, emerald green, serpentine, glowing yellow eyes, smooth scales along its body, large flexible wings, razor-sharp black claws, long sinuous tail.",image_2/dragon/19_3.png
dragon,"dragon type, medium size, emerald green, serpentine, piercing yellow eyes, smooth scales along body, large leathery wings, curved black claws, long whip-like tail with a fin-like tip.",image_2/dragon/20_2.png
dragon,"dragon type, massive, dark green, reptilian, glowing yellow eyes, elongated horns on head, small wings, razor-sharp black talons, spiked tail.",image_2/dragon/21_3.png
dragon,"dragon type, massive, emerald green, serpentine, glowing golden eyes, jagged horns on head, large leathery wings, razor-sharp obsidian claws, long coiled tail.",image_2/dragon/22_5.png
dragon,"dragon type, colossal, emerald green, serpentine, piercing yellow eyes, jagged scales along its spine, vast wings, elongated silver horns, powerful coiling tail.",image_2/dragon/23_2.png
dragon,"Dragon type, medium-sized, emerald green, slender and serpentine, shimmering golden scales, long whiskers on face, frilled head with silver accents, small but elegant wings, razor-sharp ebony claws, whiplike tail.",image_2/dragon/24_1.png
dragon,"Dragon type, medium-sized, green, serpentine, elegant silver scales, leaf-like fronds from lower back to tail tip, slender head with glowing yellow eyes, long feathery whiskers, small wings with a translucent sheen, sharp emerald claws",image_2/dragon/25_4.png
dragon,"dragon type, medium-sized, emerald green, serpentine, shimmering silver scales, curved horns on head, sleek body with elongated fins, small agile wings, razor-sharp talons, slender tapering tail.",image_2/dragon/26_4.png
dragon,"flying dragon type, massive, emerald green, serpentine, menacing silver eyes, jagged black horns on head, expansive leathery wings, razor-sharp fangs, long and slender tail with spade-shaped tip.",image_2/dragon/27_3.png
dragon,"dragon type, medium-sized, emerald green, serpentine, fiery orange eyes, smooth scales with golden patterns, expansive translucent wings, razor-sharp silver fangs, slender forked tail.",image_2/dragon/28_3.png
dragon,"dragon type, medium-sized, dark green, serpentine, menacing golden eyes, curved horns on head, elongated whiskers on snout, leathery wings with tattered edges, razor-sharp black talons, sinuous tail.",image_2/dragon/29_3.png
dragon,"rock type, medium-sized, grayish-brown, rugged, stone-like crest, jagged rocky scales on body, broad sturdy wings, blunt gray claws, robust segmented tail.",image_2/dragon/30_2.png
fighting,"fighting type, bipedal, humanoid, dark brown skin, two curved horns on head, piercing yellow eyes, average build with agile limbs, long tail with a tuft at the end, zigzag patterns on arms and legs.",image_2/fighting/1_4.png
fighting,"fighting type, quadrupedal, feline-like, deep orange fur, pointed ears, intense yellow eyes, lean and agile frame, long whip-like tail, black stripe markings across its back.",image_2/fighting/2_5.png
fighting,"fighting type, bipedal, humanoid, tan skin, two curved horns on head, intense yellow eyes, broad shoulders, long arm wraps, spiked knuckles, swirling tattoos on arms.",image_2/fighting/3_2.png
fighting,"fighting type, bipedal, humanoid, reddish-brown skin, crest-like head fin, piercing yellow eyes, broad shoulders, powerful arms, thick legs, patterned arm bands.",image_2/fighting/4_1.png
fighting,"fighting type, bipedal, humanoid, dark brown skin, two horn-like protrusions on head, narrow orange eyes, lean build, elongated arms, spiral-like arm markings.",image_2/fighting/5_2.png
fighting,"fighting type, bipedal, humanoid, reddish-brown fur, two pointed ear-like protrusions, narrow yellow eyes, lean muscular build, short spiky tail, jagged horn-like shoulder spikes.",image_2/fighting/6_1.png
fighting,"fighting type, quadrupedal, canine-like, tawny fur, sharp black claws, piercing yellow eyes, lean and agile frame, bushy tail, diagonal stripes on the back.",image_2/fighting/7_3.png
fighting,"fighting type, bipedal, humanoid, dark brown skin, two horn-like protrusions on the head, small yellow eyes, lean and agile frame, long flexible tail, triangular chest markings.",image_2/fighting/8_2.png
fighting,"fighting type, bipedal, humanoid, tan skin, helmet-like crest with two curved horns, small yellow eyes, slender yet toned frame, spiky tail, symmetrical arm markings.",image_2/fighting/9_1.png
fighting,"fighting type, bipedal, humanoid, fiery orange skin, angular head crest, sharp black eyes, broad shoulders, long jagged tail, flame-like forearm markings.",image_2/fighting/10_2.png
fighting,"fighting type, bipedal, humanoid, dark orange skin, two horn-like protrusions on head, narrow green eyes, athletic build, long tail, spiral markings on arms.",image_2/fighting/11_1.png
fighting,"fighting type, bipedal, humanoid, dark brown fur, large circular ears, bright yellow eyes, strong arms, bushy tail, white stripes on forearms.",image_2/fighting/12_1.png
fighting,"fighting type, bipedal, humanoid, deep red skin, two horn-like protrusions on the head, intense black eyes, lean yet robust frame, elongated tail with a tuft at the end, stripe patterns across the arms and legs.",image_2/fighting/13_3.png
fighting,"fighting type, bipedal, humanoid, dark brown fur, elongated canine teeth, piercing yellow eyes, lean and agile frame, long bushy tail, claw-like hand markings.",image_2/fighting/14_2.png
fighting,"fighting type, bipedal, humanoid, tan skin, two horn-like protrusions on head, small yellow eyes, lean but toned frame, long coiled tail, segmented arm bands.",image_2/fighting/15_3.png
fighting,"fighting type, bipedal, humanoid, red-brown fur, two horn-like protrusions, piercing yellow eyes, slender yet toned physique, long bushy tail, striped arm and leg markings.",image_2/fighting/16_1.png
fighting,"fighting type, bipedal, humanoid, tan skin, two long ears, sharp yellow eyes, lean and athletic build, long slender tail, swirl patterns on shoulders.",image_2/fighting/17_5.png
fighting,"fighting type, bipedal, humanoid, deep brown skin, two horn-like protrusions on head, piercing yellow eyes, broad shoulders, long powerful arms, short legs, spiral markings on forearms.",image_2/fighting/18_5.png
fighting,"fighting type, bipedal, humanoid, dark green skin, two horn-like projections on head, piercing yellow eyes, athletic build, long tail, swirl-like arm markings.",image_2/fighting/19_2.png
fighting,"fighting type, bipedal, humanoid, sandy brown skin, two horn-like protrusions on head, vibrant yellow eyes, athletic build, long tail, jagged markings on arms.",image_2/fighting/20_1.png
fighting,"fighting type, bipedal, humanoid, dark green skin, sharp crest on head, bright yellow eyes, slender but toned frame, long whip-like tail, spike-like markings on forearms.",image_2/fighting/21_1.png
fighting,"fighting type, bipedal, humanoid, tan fur, pointed ears, piercing black eyes, lean but strong build, long bushy tail, claw-like hand structures, chest covered in thick fur.",image_2/fighting/22_2.png
fighting,"fighting type, bipedal, humanoid, tan skin with black stripes, angular jaw, small pointed ears, intense orange eyes, broad shoulders, long arms, spiked bracelets on wrists.",image_2/fighting/23_2.png
fighting,"fighting type, bipedal, humanoid, tan skin, pointed ears, sharp gaze, broad shoulders, long tail, tribal-patterned armbands.",image_2/fighting/24_4.png
fighting,"fighting type, bipedal, humanoid, dark brown skin, four horn-like protrusions on head, piercing yellow eyes, broad shoulders, long tail, swirl-like arm markings.",image_2/fighting/25_5.png
fighting,"fighting type, bipedal, humanoid, bronze skin, sharp jawline, intense yellow eyes, athletic build, long braided tail, swirling arm markings.",image_2/fighting/26_2.png
fighting,"fighting type, bipedal, humanoid, sandy brown skin, two horn-like protrusions on head, intense yellow eyes, lean muscular build, segmented tail, swirling chest tattoo.",image_2/fighting/27_4.png
fighting,"fighting type, bipedal, humanoid, deep brown skin, jagged crest on head, bright yellow eyes, broad shoulders, long arms, intricate arm band markings, stout tail.",image_2/fighting/28_1.png
fighting,"fighting type, bipedal, humanoid, tan skin, two horn-like protrusions on its head, small yellow eyes, lean and agile frame, long swirling tail, dark gloves on its hands and feet.",image_2/fighting/29_2.png
fighting,"fighting type, bipedal, humanoid, sandy brown skin, prominent jawline, bright yellow eyes, lean athletic build, long flowing scarf-like appendage, decorative ankle wraps.",image_2/fighting/30_3.png
poison,"poison type, sleek, quadrupedal, dark green body with leaf-like patterns, pale underbelly, narrow, luminous eyes, forked tail with venomous tips, agile limbs for swift movement.",image_2/poison/1_4.png
poison,"Poison type, sizable, amphibious appearance, vibrant green skin with black splotches, reddish underbelly with zigzag patterns, bulbous eyes that exude a toxic glare, extended forked tongue, retractable spines along its back",image_2/poison/2_5.png
poison,"Poison type, slim, slug-like, green body, blue spots scattered across its back, bulbous eyes on stalks, sticky purple ooze dripping from its mouth, retractable feelers.",image_2/poison/3_3.png
poison,"Poison type, sleek, agile, deep green body, dark violet dorsal fins with a speckled pattern, glowing crimson eyes, forked silver tongue, retractable fangs.",image_2/poison/4_5.png
poison,"Poison type, sleek, insect-like green exoskeleton, vibrant orange spots across its back, segmented antennae, compound azure eyes, slender forelimbs with venomous barbs, agile wings emitting a soft hum.",image_2/poison/5_4.png
poison,"Poison type, short, stumpy body, green skin, dark spots scattered across its back, beady black eyes, sharp yellow teeth, retractable spikes along its spine.",image_2/poison/6_2.png
poison,"Poison type, compact, round body, dark green with speckled patterns, narrow eyes with a menacing stare, short but sharp fangs, vibrant blue markings along its back, emits a faint toxic mist.",image_2/poison/7_4.png
poison,"Poison type, small, spherical, deep green body, pale blue spots scattered throughout, narrow red eyes, thin black antennae, wispy pale spores emitted constantly.",image_2/poison/8_2.png
poison,"bipedal creature, mottled green skin, dark patches resembling camouflage, broad shoulders, muscular arms, elongated fingers with sharp claws, flat face with small eyes, tusk-like teeth protruding upwards from lower jaw, spiked tail.",image_2/poison/9_1.png
poison,"Poison type, short, squat, bright green body, dark green spots with patches, beady black eyes, small curved tusks, pudgy legs with tiny sharp claws.",image_2/poison/10_4.png
poison,"Poison type, stocky, quadrupedal body, deep green skin with lighter green spots, red eyes, short and pointed ears, retractable spikes on its back, thick tail.",image_2/poison/11_4.png
poison,"Poison type, stout, round body covered in green scales, darker green diamond patterns on its back, sharp crimson eyes, retractable fangs that excrete venom, short tail with a barbed tip, capable of inflating its body to intimid",image_2/poison/12_4.png
poison,"Poison type, small, reptilian, dark green scales, pale cream underbelly with diamond patterns, narrow slit-pupil eyes, forked black tongue, expandable throat pouch, venomous bite.",image_2/poison/13_2.png
poison,"Poison type, covered in slick, emerald scales, neon green spots scattered across its back, round, crimson eyes, elongated fangs protruding from its mouth, dexterous tail ending in a stinger, emits foul-smelling gas from pores",image_2/poison/14_3.png
poison,"Poison type, stocky, quadrupedal, green body with dark splotches, orange frills along the spine, beady eyes with a fierce glare, wide mouth with venomous fangs, sturdy legs with sharp claws.",image_2/poison/15_5.png
poison,"Poison type, squat, round body, deep green skin, mottled brown spots, large lidless eyes, broad flat mouth, slick texture, toxic spines along its back.",image_2/poison/16_5.png
poison,"venomous green body, slender and coiled, emerald scales glistening in the light, crimson underbelly with swirling patterns, piercing green eyes with narrow pupils, forked silver tongue flicking in and out, expandable hood with vibrant marks",image_2/poison/17_3.png
poison,"Poison type, short, stocky, dark green body, light green spots along the back, round red eyes, broad flat tongue, spiky tail.",image_2/poison/18_3.png
poison,"Poison type, slender, elongated, dark green body, lime green spots along the sides, sharp crest running down its back, piercing red eyes, thin black tongue, retractable fangs.",image_2/poison/19_3.png
poison,"Poison type, stout, four-legged, olive green body, dark green spots scattered across its back, narrow eyes with yellow sclera, forked lime green tongue, small yet sturdy horns.",image_2/poison/20_5.png
poison,"Poison type, wide and flat body, deep green scales, fiery orange spots scattered across the back, narrow venomous fangs protruding, glowing teal eyes, sinuous tail, toxic barbs along the spine.",image_2/poison/21_5.png
poison,"Poison type, sleek and agile, emerald-green body, dark green spots scattered across its back, narrow eyes with a glowing ruby hue, forked black tongue, retractable fangs, swift and silent movements.",image_2/poison/22_3.png
poison,"Poison type, small, spherical, dark green body, speckled with black spots, beady yellow eyes, tiny pointed ears, red-tipped spikes protruding from the back, wide, mischievous grin.",image_2/poison/23_5.png
poison,"Poison type, slender, amphibian-like body, vibrant green skin with darker splotches, smooth underbelly with lighter coloration, bulbous eyes with horizontal pupils, short but agile limbs, wide mouth with a sticky blue tongue.",image_2/poison/24_1.png
poison,"venomous type, sleek, snake-like, green body, orange underbelly with diamond patterns, glowing red eyes, forked purple tongue, expandable hood, sharp fangs.",image_2/poison/25_4.png
