Type,Description,Image Path
grass,"grass type, medium-sized, bright green biped, slender vines draping from its arms, round yellow eyes, large blooming flower on its back, broad leaves covering its shoulders and hips, sturdy two-toed feet, gentle fragrance emanating from its",image_2/grass/22_1.png
grass,"Grass type, medium-sized, bright-green biped, wide fan-like leaves extending from arms, vivid yellow eyes, two short antennae on head, long slender tail with leaf-like tip, small clusters of dark-green spots on back.",image_2/grass/23_4.png
grass,"Grass type, medium-sized, bright-green biped, long vines extending from arms, small yellow eyes, large leafy frill around neck, three-toed feet, subtle flower markings scattered across body.",image_2/grass/24_5.png
grass,"large, sunlight-yellow biped, leafy fronds extending from arms, small brown eyes, broad smile, long vine-like tail, dark-green vines wrapped around torso, three-leaf crest on head.",image_2/grass/25_3.png
grass,"Grass type, medium-sized, lime-green biped, leafy vines extending from its arms, bright yellow eyes, two broad leaves form a crest on its head, sturdy legs with three long nails, intricate vine patterns across its back.",image_2/grass/26_3.png
grass,"grass type, medium-sized, light-brown quadruped, leafy vine tail with a flower bud at the tip, bright yellow eyes, broad flat feet with two toes, delicate green fronds sprouting along its back.",image_2/grass/27_5.png
grass,"grass type, serpentine body, bright green scales, vibrant yellow fronds along its back, piercing blue eyes, slender limbs with sharp claws, delicate vines wrapped around its tail.",image_2/grass/28_5.png
grass,"tree-like Pokémon, elongated trunk-like body, vibrant green canopy of leaves atop head, large brown eyes, thick bark-like legs with broad roots spreading outwards, clusters of small red fruits hanging from branches, mossy growth covering parts of the bark.",image_2/grass/29_4.png
grass,"grass type, slender blue quadruped, bright yellow petals on its back, small purple eyes, webbed feet with white claws, vine-like tail with small leaves sprouting out.",image_2/grass/30_4.png
psychic,"psychic type, pink, levitating, star-shaped head, elongated snout, four small crescent-shaped appendages on the back, two flowing ribbons on each side, three slender digits on hands and feet.",image_2/psychic/1_3.png
psychic,"Psychic type, pink, quadrupedal, slender body with feline features, large round head, long thin tail with a bulbous tip, two large oval ears positioned on the sides, bright blue eyes, small hands and feet with three fingers and",image_2/psychic/2_5.png
psychic,"psychic type, pink, quadrupedal, feline-like body, long whip-like tail, blue eyes, round red gem on its forehead, large ears, slender limbs, three small toes on each paw.",image_2/psychic/3_2.png
psychic,"psychic type, blue, quadrupedal, sleek streamlined body, long flowing mane along its back, horn on forehead resembling a crystalline structure, violet eyes with a serene expression, two elongated tails with ribbon-like extensions.",image_2/psychic/4_4.png
psychic,"psychic type, pink, bipedal, star-shaped face, short rounded snout, two long antenna-like extensions on head, white flowing robe-like structure around body, five slender fingers on each hand and three toes on each foot.",image_2/psychic/5_4.png
psychic,"Psychic type, pastel pink, bipedal, round head with delicate features, large doe-like eyes, tuft of fur atop head, slender arms with ribbon-like extensions flowing from wrists, small paws with three fingers, long tail with a heart-shaped",image_2/psychic/6_5.png
psychic,"psychic type, pink, bipedal, sleek oval face, rounded snout, two large crescent-shaped ears, shimmering silver markings on its arms and chest, slender fingers with three digits, footpads with swirling patterns.",image_2/psychic/7_1.png
psychic,"psychic type, blue, bipedal, oval-shaped head, long slender tail, two large round eyes, sleek white markings on arms and legs, three elongated fingers and toes.",image_2/psychic/8_4.png
psychic,"psychic type, pale pink, quadrupedal, cat-like face, long tail with a bulbous tip, large pointed ears, sleek and slender body, three small toes on each paw.",image_2/psychic/9_5.png
psychic,"psychic type, pale blue, serpentine body, crescent-shaped head, long tapered tail, two slender antennae on top of the head, shimmering patterns adorning its scales, four fin-like extensions along its back.",image_2/psychic/10_1.png
psychic,"psychic type, purple, floating, spherical body, large hypnotic eyes, small mouth, two short antennae on top of head, ethereal mist surrounding body, two thin arms with four long fingers, no visible legs.",image_2/psychic/11_3.png
psychic,"Psychic type, pale blue, quadrupedal, sleek elongated body, long flowing tail, large graceful wings, shimmering crescent-shaped patterns on its sides, delicate crystal-like claws, luminous indigo eyes.",image_2/psychic/12_2.png
psychic,"dark purple, bipedal, crescent-shaped head with a glowing gem, slender arms, flowing white mane from head to back, sharp eyes, silver armor-like bands on wrists and ankles, three fingers and toe claws",image_2/psychic/13_3.png
psychic,"Psychic type, light blue, quadrupedal, feline-like face, sleek tail, glowing purple eyes, large crescent-shaped ears, translucent fin-like structures along its sides, four slender digits on each paw.",image_2/psychic/14_1.png
psychic,"psychic type, blue, quadrupedal, feline-like appearance, sleek body with fine fur, large pointed ears with a pinkish tinge inside, thin whip-like tail with a star-shaped tip, four slender paws with three toes each.",image_2/psychic/15_3.png
psychic,"Psychic type, light pink, quadrupedal, elongated neck, crescent-shaped tail tip, large oval eyes, two antenna-like protrusions on head, bulbous extensions on elbows and knees, five elongated digits on hands and feet.",image_2/psychic/16_5.png
psychic,"Psychic type, pink, quadrupedal, cat-like face, long slender tail, large blue eyes, round paws with three short digits, tufted fur on the head and neck, psychic aura surrounding the body.",image_2/psychic/17_1.png
psychic,"psychic type, purple, bipedal, long oval-shaped face, slender blue snout, two elongated ears, white fur-like extensions on shoulders and hips, four slender digits on hands and feet.",image_2/psychic/18_1.png
psychic,"Psychic type, purple, bipedal, oval-shaped head, narrow blue eyes, two thin antennae, flowing white cape-like appendage around its body, slender arms tapering to pointed tips, two pointed toes on each foot.",image_2/psychic/19_4.png
psychic,"Psychic type, pink, quadrupedal, feline-like face, elongated whiskers, two rounded ears, sleek white markings on forehead and tail, long slender tail with a bulbous tip, three sharp claws on each paw.",image_2/psychic/20_1.png
psychic,"psychic type, purple, bipedal, circular face, large round eyes, two floppy ears, star-shaped markings on its forehead, long flowing robe-like body, four slender digits on hands and feet.",image_2/psychic/21_5.png
psychic,"psychic type, purple, quadrupedal, cat-like face, long, slender tail, large oval ears, blue markings on forehead and tail tip, three paw pads on each foot.",image_2/psychic/22_4.png
psychic,"psychic type, lavender, bipedal, diamond-shaped face, long azure snout, two curved antennae, silver crescent-shaped markings on chest and back, four slender digits on hands and feet.",image_2/psychic/23_4.png
psychic,"psychic type, blue, quadrupedal, sleek body, large crest-like wings, small horn on forehead, two long ribbon-like tails, slender legs, four sharp digits on each foot.",image_2/psychic/24_3.png
psychic,"psychic type, blue, quadrupedal, long slender neck, crescent moon-shaped face, narrow eyes with a serene gaze, white flowing mane extending down its back, three-pronged tail, short legs with three curved claws on each foot.",image_2/psychic/25_3.png
psychic,"psychic type, pink, quadrupedal, slender body, crescent moon-shaped face, long flowing tail, large round eyes, three white elongated claws on each paw.",image_2/psychic/26_1.png
psychic,"Psychic type, pale purple, quadrupedal, sleek and slender body, feline-like features, long thin tail with a forked end, large almond-shaped eyes, two pointed ears, tufts of fur on chest, three clawed toes on",image_2/psychic/27_4.png
psychic,"Psychic type, purple, quadrupedal, crescent-shaped tail, slender horn on forehead, large red eyes, long neck, streamlined body, three sharp claws on each foot.",image_2/psychic/28_5.png
psychic,"Psychic type, pink, quadrupedal, feline-like face, long slender tail with an oval tip, pointed ears, blue gem embedded on forehead, three digits on each paw, sleek body with a smooth texture.",image_2/psychic/29_2.png
psychic,"Psychic type, violet, humanoid, oval-shaped head, large vivid eyes, two elegant antennae, ethereal cape-like extensions on back, five slender digits on hands and feet.",image_2/psychic/30_5.png
rock,"rock type, medium-sized, turtle-like, gray and blue stones, six bright yellow dots arranged in a circle on the face, segmented rock shell, thick limbs, flat feet.",image_2/rock/1_4.png
rock,"rock type, medium-sized, turtle-like, gray and blue stones, three blue crystals forming a triangle on its shell, mosaic-patterned shell, broad front limbs, stubby hind legs.",image_2/rock/2_1.png
rock,"rock type, massive, fortress-like, dark gray granite with silver streaks, three vertical yellow stripes on face, interlocking boulders, shield-shaped arms, broad sturdy legs.",image_2/rock/3_2.png
rock,"rock type, small, turtle-like, dark gray and blue rocks, blue crystalline patterns on its shell, glowing blue eyes, segmented rocky shell, stubby legs, small tail.",image_2/rock/4_1.png
rock,"rock type, massive, dinosaur-like, dark gray and silver rocks, three blue crystals on forehead, plated with jagged rocks, hammer-shaped tail, sturdy limbs.",image_2/rock/5_1.png
rock,"rock type, medium-sized, beetle-like, grey and silver rocks, four silver dots forming a square on its back, segmented exoskeleton, scissor-like pincers, six sturdy legs.",image_2/rock/6_3.png
rock,"rock type, medium-sized, turtle-like, gray jagged shell, six green crystals embedded in shell, eyes glow teal, rough-textured skin, sturdy limbs, rounded snout, thick tail.",image_2/rock/7_1.png
rock,"rock type, medium-sized, turtle-like, gray and green rocky shell, turquoise gems embedded on its back, six turquoise dots in a circle pattern on its face, rugged stone skin, sturdy, four powerful legs with thick claws",image_2/rock/8_2.png
rock,"rock type, medium-sized, towering structure, gray and blue stones, three blue markings on each side of its face, craggy surface resembling cracked earth, long arms with pointed fingers, stumpy feet.",image_2/rock/9_2.png
rock,"rock type, towering, boulder-like, gray and dark blue stones, five blue dots in diagonal line on chest, uneven rock surface, heavy stone fists, thick legs.",image_2/rock/10_2.png
rock,"rock type, medium-sized, statuesque, gray and dark purple rocks, six purple dots in a ""V"" shape on face, sleek and angular rock formations, long segmented arms, solid and rounded feet.",image_2/rock/11_2.png
rock,"Rock type, medium-sized, turtle-like, green and gray shell with spikes, four jagged rock formations on back, rocky head with glowing yellow eyes, sturdy limbs with sharp claws, slow-moving but incredibly strong.",image_2/rock/12_2.png
rock,"rock type, medium-sized, knight-like, gray and silver armor plates, four blue crystals embedded in chest in diamond shape, smooth stone surface, lance-like arms, sturdy stance.",image_2/rock/13_4.png
rock,"rock type, medium-sized, spire-like, gray and copper-colored stones, five glowing blue lines forming a star shape across its head, smooth boulder segments, triangular stone arms, sturdy wide base.",image_2/rock/14_2.png
rock,"rock type, medium-sized, turtle-like appearance, dark gray rocky shell, glowing blue lines forming a spiral pattern on its shell, rough stone texture, sturdy legs with sharp claws, short tail with a pointed end.",image_2/rock/15_5.png
rock,"rock type, medium-sized, tortoise-like, gray and green stones, eyes with an intense green glow, shell covered in moss and lichen, sturdy limbs, short tail, ancient runes etched on shell",image_2/rock/16_5.png
rock,"Rock type, medium-sized, quadrupedal form, gray and jagged stone skin, two bright blue crystalline horns on its head, glowing blue symbols along its back, sturdy rock-like legs, sharp rocky tail, deep-set eyes resembling polished sapphi",image_2/rock/17_2.png
rock,"rock type, medium-sized, turtle-like, dark gray rocky shell, bright blue crystalline spikes protruding from back, four sturdy legs with sharp claws, long tail with rocky segments, small head with V-shaped yellow marking on forehead.",image_2/rock/18_2.png
rock,"rock type, medium-sized, bipedal, grey and blue stone armor, crystalline shards embedded in shoulders and back, three blue diamond-shaped eyes on face, jagged rocks form symmetrical patterns along arms and legs, sturdy tail used for balance and defense",image_2/rock/19_5.png
rock,"rock type, colossal, titan-like, dark gray and silver boulders, six blue dots forming a triangle on chest, rugged armor of interlocking stones, massive fists, sturdy legs.",image_2/rock/20_3.png
rock,"rock type, medium-sized, humanoid shape, dusty gray and granite-like texture, six glowing blue crystals arranged in a circle on chest, mosaic-like pattern of uneven stone plates, boulder arms with sharp edges, sturdy legs resembling pillars.",image_2/rock/21_2.png
rock,"rock type, large, monolithic, dark gray stone, embedded with glowing blue crystals, eyes resembling glowing blue ovals, heavily chipped surface, massive arms with wide palms, sturdy stance with thick legs.",image_2/rock/22_5.png
rock,"water-type, medium-sized, turtle-like, blue and gray shell, four gray spikes protruding from shell, bright yellow eyes, webbed feet, long tail with a shell tip.",image_2/rock/23_3.png
rock,"rock type, medium-sized, turtle-like, deep gray stone shell with green moss patches, piercing yellow eyes, rocky head with two short horns, jagged stone limbs, slow-moving but sturdy, large boulder-like tail.",image_2/rock/24_2.png
rock,"Rock type, medium-sized, turtle-like, grey and blue boulders, three blue lines on back forming a triangle, heavily armored shell, sturdy round tail, stout limbs.",image_2/rock/25_4.png
rock,"rock type, medium-sized, turtle-like, dark gray rocks with green moss patches, four small green gems forming a square on its back, sturdy shell with geometric patterns, thick legs, webbed feet.",image_2/rock/26_2.png
rock,"rock type, massive, fortress-like, gray and black stones, glowing blue crystals embedded in its torso, two parallel blue lines on its face, rugged rock armor, hammer-like arms, sturdy stance with broad feet.",image_2/rock/27_5.png
rock,"rock type, small, turtle-like, gray and green rocks, three green spots on its shell, smooth stone surface, round body, stubby legs and a short tail.",image_2/rock/28_3.png
rock,"ice type, large, crystal-like, pale blue and white shards, seven blue dots in ""X"" shape on face, cluster of jagged ice, pointed arms, sturdy base.",image_2/rock/29_4.png
rock,"rock type, medium-sized, turtle-like, dark gray boulders, four glowing blue hexagons on shell, segmented armored plates, sturdy limbs, thick tail, determined expression.",image_2/rock/30_5.png
ground,"ground type, small, beige, covered in rocky scales, narrow yellow eyes, flat snout, strong limbs for digging, burrows deep underground.",image_2/ground/1_2.png
ground,"ground type, small, tan, stands on two legs, large ears, black slit-like eyes, long bushy tail, robust claws, digs deep tunnels.",image_2/ground/2_5.png
ground,"ground type, medium-sized, gray, rocky exterior, jagged edges, deep-set amber eyes, wide mouth, tough and resilient surface, burrows deep underground.",image_2/ground/3_4.png
ground,"ground type, small, gray, turtle-like, rough rocky skin, angular head, red yeux incandescents, likes to bask in sunlight, burrows deep into caves when disturbed.",image_2/ground/4_5.png
ground,"Ground type, small, tan, spade-shaped claws, long snout, sharp eyes, thick leathery skin, burrows deeply into the earth.",image_2/ground/5_5.png
ground,"ground type, small, sandy yellow, resembles a small mole, two bright round eyes, pointed snout, coarse fur, digs intricate tunnels.",image_2/ground/6_1.png
ground,"ground type, bulky, gray, rocky exoskeleton, large jagged horns, glowing orange eyes, sturdy legs with sharp claws, curls into a ball, rolls swiftly over rugged terrain.",image_2/ground/7_4.png
ground,"ground type, large, greyish-brown, sturdy four-legged body, piercing yellow eyes, wide flat snout, thick protective skin, roams vast deserts.",image_2/ground/8_1.png
ground,"ground type, medium-sized, tan, tough armor-like scales, spiky tail, small round eyes, triangular dark snout, sharp claws for digging, burrows deep underground.",image_2/ground/9_4.png
ground,"Ground type, medium-sized, tan with a rocky texture, large boulder-like body, piercing yellow eyes, rugged shell for protection, short sturdy legs, burrows deep underground.",image_2/ground/10_3.png
ground,"Ground type, rugged, gray, covered with rocky plates, piercing yellow eyes, large flat snout, powerful legs, enjoys sunbathing on boulders, creates deep tunnels.",image_2/ground/11_5.png
ground,"ground type, small, gray, tough hide, spiny back, blue eyes, sturdy legs, able to withstand heavy impacts.",image_2/ground/12_1.png
ground,"ground type, bulky, gray, large tusks, rough and rocky skin, sturdy legs, wide feet for stability, digs deep tunnels.",image_2/ground/13_1.png
ground,"Ground type, medium-sized, tan and rocky, sturdy stance, broad shoulders, thick limbs with sharp claws, rugged hide, traverses rocky terrains easily.",image_2/ground/14_3.png
ground,"large, grayish-brown, quadruped, broad flat nose, pebble-like texture, powerful limbs for digging, tusked, often found near rocky terrains, thick sturdy hide, thrives in arid regions.",image_2/ground/15_4.png
ground,"desert dweller, tough-skinned, sandy yellow, small rocky protrusions on back, bright green eyes, long snout for sensing vibrations, camouflages with its surroundings, digs swiftly through sand.",image_2/ground/16_4.png
ground,"ground type, large, dark gray, rugged appearance, boulder-like body, deep-set yellow eyes, broad flat mouth, heavily armored skin, moves slowly but with great force.",image_2/ground/17_2.png
ground,"ground type, solid, brown and gray, entire body visible above ground, small sharp eyes, wide stern mouth, tough rocky skin, stands on rocky terrain.",image_2/ground/18_5.png
ground,"large, quadrupedal, gray, rugged hide, curved horns, massive jaw, shovel-like forelimbs, adept at tunneling deep underground, sharp vision in low light conditions.",image_2/ground/19_5.png
ground,"burrower body, cream color, stocky, sturdy claws, small eyes, flattened head, sensitive nostrils, thick hide, thrives in rocky terrain.",image_2/ground/20_4.png
ground,"ground type, small, grey, sturdy legs, stone-like hide with faint cracks, dull amber eyes, rugged jaw, tough and resilient, often found wandering rocky terrain.",image_2/ground/21_3.png
ground,"ground type, small, green, resembles a turtle, shell with rocky pattern, sturdy legs, bright yellow eyes, strong digging claws, burrows deep underground.",image_2/ground/22_5.png
ground,"sandy brown fur, medium-sized, four sturdy legs, deep-set black eyes, wide snout, tough hide, digs deep networks of tunnels.",image_2/ground/23_4.png
ground,"rock type, medium-sized, gray, covered in sharp-edged ridges, glowing red eyes, flat broad snout, thick protective skin, lives in rocky caves",image_2/ground/24_3.png
ground,"mole-like, small, brown and beige, long claws, narrow eyes, sharp snout, tough skin, digs deep tunnels.",image_2/ground/25_3.png
ground,"Ground type, small, rocky gray, body covered in jagged spikes, yellow eyes that glow, hefty and solid build, digs deep underground with powerful claws.",image_2/ground/26_4.png
ground,"ground type, stout, beige, mud-caked body, flat wide head with earthy spots, round amber eyes, thick round snout, coarse sandy fur, digs burrows close to riverbanks.",image_2/ground/27_4.png
ground,"ground type, large, rocky, gray, jagged body with rough texture, glowing yellow eyes, massive square jaw, powerful limbs with sharp claws, spends time in caves and mountains.",image_2/ground/28_5.png
ground,"cuboidal, brown with darker stripes, large flat head, deep-set eyes, wide mouth, short sturdy legs, tough hide, dwells in rocky terrains, excels at digging through soil and rock.",image_2/ground/29_3.png
ground,"spiny body, ground type, small, tan, always holds a stick, sharp claws, quick digger, spends most of the day underground, large expressive eyes.",image_2/ground/30_3.png
flying,"flying type, swallow-like, vibrant blue feathers, white underbelly, sleek black markings on wings, pointed yellow beak, small talons, bright green eyes with a dark stripe above.",image_2/flying/1_2.png
flying,"flying type, hawk-like, dark brown feathers with light brown speckles, creamy white breast and underwing feathers, sharp yellow eyes with dark lines extending from the corners, hooked yellow beak, four-toed talon feet, long tail",image_2/flying/2_3.png
flying,"Flying type, parrot-like, vibrant green feathers, yellow underbelly, long colorful tail with red and blue tips, curved yellow beak, two-toed feet, bright orange eyes with white rings around them.",image_2/flying/3_2.png
flying,"flying type, hawk-like, dark brown feathers, cream-colored underbelly, sharp black-tipped wings, yellow hooked beak, talon-like feet with four claws, piercing blue eyes with a white stripe above.",image_2/flying/4_4.png
flying,"Flying type, hawk-like, dark brown feathers, cream-colored underbelly, sharp black talons, hooked yellow beak, piercing golden eyes, broad wings with lighter streaks, long tail with dark banding.",image_2/flying/5_2.png
flying,"Flying type, owl-like, light brown plumage, cream-colored facial disc, sharp talons, mottled wings and tail, yellow eyes with dark rings, hooked beak, tufted eyebrows.",image_2/flying/6_4.png
flying,"flying type, falcon-like, sleek black feathers, cream-colored breast feathers, sharp black talons, keen yellow eyes with a dark outline, hooked gray beak, broad wings with silver tips, long streamlined tail.",image_2/flying/7_2.png
flying,"flying type, hawk-like, dark brown feathers, cream-colored breast feathers, white mask around face, sharp yellow beak, four-toed talons, piercing amber eyes with black outline.",image_2/flying/8_5.png
flying,"flying type, owl-like, tawny feathers, cream-colored face disk, large golden eyes, short hooked beak, four-toed talons, darker brown patterns along wings, silent stealthy flight.",image_2/flying/9_3.png
flying,"flying type, hawk-like, bronze feathers, cream underbelly, sharp black stripe above eyes, hooked yellow beak, four-toed talons, piercing orange eyes with dark ring around them.",image_2/flying/10_2.png
flying,"hawk-like, brown feathers, cream underbelly, sharp yellow beak, piercing orange eyes, dark band across chest, talon-like four-toed feet, long tail with a banded pattern",image_2/flying/11_1.png
flying,"flying type, hawk-like, brown feathers with lighter tips, white underbelly, dark brown streaks across eyes resembling a mask, sharp yellow beak, taloned feet, piercing blue eyes with a dark outline.",image_2/flying/12_5.png
flying,"flying type, swallow-like, sky blue feathers, white underbelly, dark blue wings, short orange beak, four-toed feet, bright green eyes with yellow stripe above.",image_2/flying/13_2.png
flying,"Flying type, hawk-like, bronze feathers, cream underbelly, sharp golden beak, piercing yellow eyes, dark brown talons, wide wingspan with red-tipped feathers, streamlined body.",image_2/flying/14_3.png
flying,"flying type, hawk-like, bronze feathers, cream underbelly, sharp yellow eyes, dark brown mask around face, hooked gray beak, four-toed talons, long tail feathers with orange tips.",image_2/flying/15_3.png
flying,"flying type, eagle-like, dark brown feathers, cream-colored breast feathers, black talons, sharp yellow beak, piercing amber eyes, white crown on head, broad wingspan with light tan undersides.",image_2/flying/16_5.png
flying,"falcon-like, sleek body, silver feathers, white-tipped wings, sharp yellow beak, piercing orange eyes, dark mask pattern around eyes, powerful talons, striped tailfeathers, streamlined silhouette.",image_2/flying/17_3.png
flying,"Flying type, falcon-like, bronze feathers, cream-colored underbelly, sharp hooked beak, slender tail with dark stripes, yellow talons, sharp gray eyes with black stripe above.",image_2/flying/18_3.png
flying,"flying type, owl-like, bronze feathers, cream-colored face, large round eyes with deep yellow irises, small black beak, talon-tipped feet, broad wings with dark brown streaks, tufted ears with a hint of orange",image_2/flying/19_1.png
flying,"flying type, eagle-like, dark brown feathers, cream-colored breast feathers, black stripe across face, yellow beak, talon-like feet, piercing orange eyes with black outline.",image_2/flying/20_1.png
flying,"flying type, eagle-like, bronze feathers, cream-colored underbelly, sharp black talons, golden beak, wide wings with dark brown tips, piercing yellow eyes with black outlines, sleek tail.",image_2/flying/21_5.png
flying,"flying type, hawk-like, bronze feathers, cream-colored belly, black-tipped wings, sharp yellow beak, four-clawed talons, piercing green eyes with dark rings around.",image_2/flying/22_2.png
