Type,Description,Image Path
electric,"electric type, medium-sized, sleek, fox-like, covered in blue fur, large pointed ears with dark blue tips, a distinctive zigzag pattern on its sides, long bushy tail with a sparkling tip, slender legs with three toes on each paw",image_2/electric/1_1.png
electric,"Electric type, small, playful, squirrel-like, covered in soft blue fur, large fluffy tail with white streaks, small white paws, round cheeks that can store electricity, bright yellow eyes, short ears with white tips, agile and quick on its",image_2/electric/2_1.png
electric,"electric type, small, spiky, lizard-like, covered in orange scales, tall orange crest along its back, blue zigzag patterns on its sides, thin whip-like tail, sharp claws on its feet.",image_2/electric/3_4.png
electric,"Electric type, medium, sleek, canine-like, covered in blue fur, pointed yellow ears, lightning-shaped stripes along its legs, bushy tail tipped with white, sharp claws with three toes, nimble and agile.",image_2/electric/4_5.png
electric,"electric type, small, nimble, rodent-like, covered in blue fur, long ears topped with yellow tufts, white zigzag patterns on its back, stubby tail resembling a lightning bolt, short arms with three fingers.",image_2/electric/5_3.png
electric,"Electric type, medium-sized, sleek, cat-like, covered in silver fur, long pointed ears with blue tips, narrow stripes of blue zigzagging down its back, thin whip-like tail with a small spark-shaped tip, slender limbs with sharp claws",image_2/electric/6_2.png
electric,"electric type, small, cute, dog-like, covered in fluffy blue fur, pointy ears tipped with white, zigzagging stripes along its sides, spiky tail resembling a bolt of lightning, short legs with small paws.",image_2/electric/7_3.png
electric,"Electric type, medium-sized, energetic, rabbit-like, covered in blue fur, long blue ears with white tips, a zigzag pattern across its back, short legs with small paws, fluffy tail resembling a cloud, bright eyes that give off sparks when",image_2/electric/8_4.png
electric,"dog-like, medium-sized, sleek, covered in blue fur, pointed ears with yellow insides, sleek yellow stripes running down its sides, bushy tail with electric sparks at the tip, strong legs with four paws.",image_2/electric/9_1.png
electric,"Electric type, medium-sized, sleek and agile, covered in blue fur with golden stripes, long ears that end in star-shaped tips, fluffy mane around its neck, short claws on its paws, long tail with a bright yellow star at the tip.",image_2/electric/10_4.png
electric,"Electric type, small, cuddly, bird-like, covered in fluffy blue feathers, sleek wings tipped with silver, bright yellow crest on its head, short, pointed beak, long tail feathers with a zigzag pattern, tiny talons with sharp",image_2/electric/11_4.png
electric,"electric type, small, energetic, bird-like, covered in sleek blue feathers, round wings tipped with white, bright yellow crest on its head, dual white stripes along its back, short lightning bolt-shaped beak, tiny feet with three toes.",image_2/electric/12_5.png
electric,"Electric type, sleek, amphibian-like, covered in smooth blue skin, elongated limbs with agile toes, slender fingers tipped with yellow pads, fin-like structures on its back and head, long tail with a glowing tip, bright yellow eyes with keen vision",image_2/electric/13_2.png
electric,"Electric type, medium-sized, sleek, fox-like, covered in light blue fur, pointed ears tipped with white, zigzag patterns on its sides, bushy tail with a sparkling tip, slender legs with three sharp claws.",image_2/electric/14_5.png
electric,"dog-like, medium-sized, sleek, covered in blue and yellow fur, pointed blue ears, jagged yellow patterns across its back, tail shaped like a zigzag lightning bolt, powerful legs for fast running.",image_2/electric/15_3.png
electric,"electric type, small, sleek, squirrel-like, covered in white and blue fur, rounded ears, yellow cheek pouches, bushy tail with spike patterns, short limbs with three fingers.",image_2/electric/16_5.png
electric,"electric type, small, adorable, fox-like, covered in light blue fur, long pointy ears with dark blue tips, zigzag pattern on its tail, small paws with three toes, bright eyes.",image_2/electric/17_4.png
electric,"Electric type, medium-sized, sleek, fox-like, covered in smooth blue fur, pointed blue ears with white inner fur, a dark blue zigzag pattern on its back, long bushy tail with a bright blue tip, slender legs with white paws",image_2/electric/18_3.png
electric,"electric type, small, cute, feline-like, covered in blue fur, small pointed ears, white zigzag patterns on its back, slender tail that splits into two at the end, delicate paws with three tiny claws.",image_2/electric/19_5.png
electric,"Electric type, small, playful, rodent-like, coated in orange fur, large round ears with blue interiors, white oval marks on its cheeks, short curled tail that glows at the tip, stubby legs with tiny claws.",image_2/electric/20_4.png
electric,"feline-like, medium-sized, sleek, covered in smooth gray fur with electric blue stripes, bright blue eyes, tufted ears with yellow tips, long slender tail with a glowing orb at the tip, agile limbs with sharp claws, emitting a slight",image_2/electric/21_3.png
electric,"Electric type, medium-sized, sleek, cat-like, covered in shimmering blue fur, pointy ears tipped with white, a series of silver marks along its sides, a long narrow tail ending in a star-shaped tip, agile legs with sharp claws.",image_2/electric/22_5.png
electric,"Electric type, small, sleek, fox-like, covered in blue fur, long pointed ears tipped with white, lightning patterns on its sides, large fluffy zigzag tail, slender legs with three clawed toes.",image_2/electric/23_2.png
electric,"Electric type, medium-sized, sleek, wolf-like, covered in dark blue fur, sharp yellow eyes, mane of electric blue spines along its back, tail with a glowing blue tip, four sturdy legs with paw-like feet, each ending in sharp",image_2/electric/24_2.png
electric,"Electric type, small, cute, squirrel-like, covered in white fur with blue accents, pointy ears with yellow inner lining, blue stripes running along the back, bushy tail with a zigzag pattern, short arms with three fingers.",image_2/electric/25_3.png
electric,"Entry example: electric type, medium-sized, sleek, feline-like, covered in blue fur, pointed ears with yellow inner fur, a star-shaped tuft of fur at the tip of its tail, sharp claws, glowing yellow eyes.",image_2/electric/26_4.png
electric,"water type, medium-sized, turtle-like, covered in blue skin, large brown shell with white ridges, stubby tail, long neck with white patterns, strong legs with three pointed claws.",image_2/electric/27_5.png
electric,"electric type, small, nimble, ferret-like, covered in light blue fur, sleek silver whiskers that crackle with electricity, dark blue rings around its eyes, bushy tail that sparks at the tip, agile legs for swift movement.",image_2/electric/28_5.png
electric,"Entry example: electric type, medium-sized, agile, feline-like, covered in sleek blue fur, pointed ears with yellow tips, electric-blue stripes along its sides, long whip-like tail ending in a star-shaped tip, sharp claws for climbing and catching",image_2/electric/29_4.png
electric,"electric type, small, energetic, rodent-like, covered in blue fur, long blue ears with star-shaped tips, white ring pattern on its back, small crescent moon-shaped tail, tiny paws with three fingers.",image_2/electric/30_5.png
fire,"fire type, large, crimson, avian, golden plumage, fierce beak, massive wingspan, long fiery tail feathers, intense eyes, talons that crackle with heat.",image_2/fire/1_1.png
fire,"fire type, large, red, canine, white mane, muscular build, strong legs, fierce expression, sharp claws, flames flowing from its mouth.",image_2/fire/2_4.png
fire,"Fire type, medium-sized, crimson, canine, black and orange striped fur, robust build, fluffy tail, pointed ears, intimidating gaze, sharp claws, fiery mane along its back.",image_2/fire/3_3.png
fire,"fire type, medium-sized, crimson, avian, yellow crest and wingtips, sleek wings, powerful talons, piercing eyes, emits embers with each flap",image_2/fire/4_4.png
fire,"Fire type, medium-sized, red and black, quadrupedal, yellow eyes with slit pupils, dark markings across body, sharp claws, tufted ears, flame patterns along mane and tail.",image_2/fire/5_4.png
fire,"fire type, medium-sized, red, fox-like, white tufts of fur on its chest and tails, slender body, agile limbs, sharp eyes, three bushy tails with flickering flames at the tips.",image_2/fire/6_4.png
fire,"fire type, medium-sized, red and yellow, quadrupedal, shaggy mane, sturdy legs, large paws with sharp claws, blazing flames along its back, fierce eyes, long tail that flickers with fire.",image_2/fire/7_3.png
fire,"fire type, large, crimson, canine, dark mane, powerful stance, sharp claws, fierce eyes, flames around paws and tail.",image_2/fire/8_1.png
fire,"Fire type, medium-sized, red and black, quadrupedal feline, large flame-shaped mane, piercing yellow eyes, sharp retractable claws, tufted tail with flickering flame.",image_2/fire/9_4.png
fire,"fire type, medium-sized, red, avian, dark gray beak and claws, broad wings, bright orange crest atop head, two tail feathers tipped with fire.",image_2/fire/10_2.png
fire,"fire type, medium-sized, red, canine, beige-colored mane, strong legs, fierce eyes, sharp claws, fiery patterns along its back.",image_2/fire/11_5.png
fire,"fire type, medium-sized, white and red, fox-like, elegant fur, slender body, pointed ears, bushy tail with fiery tip, sharp eyes, nimble paws.",image_2/fire/12_5.png
fire,"fire type, medium-sized, red and black, canine, rocky mane, bushy tail, strong legs, sharp claws, determined eyes, horns made of flames.",image_2/fire/13_2.png
fire,"fire type, medium-sized, crimson, feline, charcoal-colored stripes, slender frame, agile limbs, piercing blue eyes, tufted ears, flame-like tail tip.",image_2/fire/14_1.png
fire,"fire type, medium-sized, red and black, canine, bushy mane, sharp claws, intense gaze, fiery patterns on fur, fluffy tail.",image_2/fire/15_5.png
fire,"fire type, medium-sized, canine, sleek, russet-colored fur, bushy tail, bright eyes, pointed ears, cream-colored paws and snout, fiery tufts at the tips of its ears and tail.",image_2/fire/16_2.png
fire,"fire type, medium-sized, dark red, feline, tufted ears, slender body, nimble limbs, sharp claws, a mane of flowing flames, bright yellow eyes.",image_2/fire/17_4.png
fire,"fire type, medium-sized, red and yellow, canine, fluffy mane and tail, sharp claws, intense eyes, black stripes along its body, emits heat when excited.",image_2/fire/18_5.png
fire,"fire type, medium-sized, dark gray, vulpine, sleek fur, coal-like patches on body, bright yellow eyes, large bushy tail with smoldering ember tips, swift and agile movements, pointed ears, nimble paws.",image_2/fire/19_4.png
fire,"fire type, medium-sized, crimson, avian, golden-feathered wings, sharp beak, long talons, fierce eyes, fiery crest atop its head, blazing trails when flying.",image_2/fire/20_1.png
fire,"Entry example: fire type, medium-sized, white and red, avian, flame patterns on wings, sharp talons, intense gaze, flame crest on head.",image_2/fire/21_1.png
fire,"fire type, medium-sized, red, canine-like, black stripes, fluffy cream-colored mane and tail, sturdy legs, sharp claws, fierce eyes, distinctive black nose",image_2/fire/22_4.png
fire,"fire type, medium-sized, fox-like, reddish-orange fur, white-tipped tail, slender legs, pointed ears, bright eyes, small flames on its back.",image_2/fire/23_5.png
fire,"Fire type, medium-sized, red and yellow, feline, fluffy mane, sleek body, sharp claws, vibrant eyes, flames at ear tips.",image_2/fire/24_5.png
fire,"fire type, medium-sized, dark red, leonine, tan underside, muscular build, flowing mane resembling flames, fierce eyes, sharp retractable claws, tail ending in a blazing tuft of fire.",image_2/fire/25_1.png
fire,"fire type, medium-sized, dark red, quadrupedal canine, black stripes across its body, fluffy cream-colored mane, bushy tail, small pointed ears, sharp fangs, bright orange eyes.",image_2/fire/26_2.png
fire,"fire type, medium-sized, red, quadrupedal, sleek body, black underside, sharp claws, pointed ears, two curved horns on the head, tail with a blazing flame at the tip.",image_2/fire/27_2.png
fire,"fire type, medium-sized, red and black, canine, bushy tail, sharp ears, muscular build, orange mane around its neck, fierce eyes, produces intense heat from its body.",image_2/fire/28_2.png
fire,"fire type, medium-sized, tan and red, quadrupedal, black markings across its body, sturdy build, sharp horn on its forehead, fiery mane that trails down its back, intense eyes, flickering flames around its paws.",image_2/fire/29_2.png
fire,"fire type, medium-sized, red and black, canine-like, cream-colored chest and underbelly, sharp ears, powerful legs, intense eyes, flames emanating from its furry tail tuft.",image_2/fire/30_2.png
water,"water type, small, sea-green, frog-like, smooth slippery skin with speckles on its back, vibrant yellow eyes that shine in the dark, webbed feet with membranous fingers, long flowing tail resembling a water lily, two rounded digits",image_2/water/1_5.png
water,"large, sleek, dark-blue, dolphin-like, smooth skin with silver streaks along its sides, small fin on its back, bright golden eyes, long flipper-fins with small webbed digits, white underbelly that extends from its chin",image_2/water/2_4.png
water,"Water type, medium-sized, dark blue, dolphin-like, sleek and streamlined body, lighter blue underbelly, small fin on its back, intelligent bright green eyes, long tapered tail, flippers resembling webbed hands.",image_2/water/3_1.png
water,"Water type, medium-sized, navy blue, dolphin-like, sleek and smooth skin with lighter blue belly, bright yellow eyes, crescent-shaped dorsal fin on its back, long and slender tail, two pointed flippers on each side.",image_2/water/4_5.png
water,"water type, medium-sized, sleek, dolphin-like, shiny silver skin with a light blue underbelly, expressive deep blue eyes, streamlined dorsal fin and tail, two large flippers with webbed digits, a series of small white spots along its",image_2/water/5_3.png
water,"Water type, medium-sized, sleek and elongated form, smooth navy blue skin with lighter streaks along its sides, streamlined body designed for speed in water, dorsal fin running along its back, two pectoral fins with slightly webbed digits, large",image_2/water/6_5.png
water,"Water type, medium-sized, dark blue, dolphin-like, sleek streamlined body with a lighter blue underbelly, bright turquoise eyes, two fin-like appendages on its back, crescent-shaped tail, four webbed flippers with a small white",image_2/water/7_1.png
water,"Water type, medium-sized, deep-sea blue, dolphin-like, sleek streamlined body with white-patterned underside, playful sparkling eyes, long flowing dorsal fin, smooth aquatic flippers with webbed fingers on each limb.",image_2/water/8_1.png
water,"water type, medium-sized, dark blue, dolphin-like, sleek shiny body with a lighter blue underside, joyful light blue eyes, dorsal fin adorned with silvery streaks, elegant flipper-like limbs with webbed ends, small white spots fleck",image_2/water/9_4.png
water,"water type, medium-sized, dark blue, dolphin-like, sleek streamlined body with silver markings, elongated fin on its back, bright azure eyes, smooth skin, agile flippers with four small digits on each, playful demeanor.",image_2/water/10_2.png
water,"water type, medium-sized, navy blue, dolphin-like, sleek body with a pale gray underbelly, fin on its back resembling a crest, large round eyes that are azure, short flippers with two pointed digits, long tail ending in a",image_2/water/11_2.png
water,"water type, medium-sized, deep blue, dolphin-like, sleek body with wave-patterned markings, small fin on its back, bright silver eyes, playful expression, two flippers on each side with a smooth edge, a crescent-shaped tail with",image_2/water/12_4.png
water,"large, grayish-blue, whale-like, smooth and glistening skin, pale underbelly with navy-blue patches, small beady eyes, four elongated fins, massive mouth lined with baleen-like fringes, powerful fluke with ocean-wave",image_2/water/13_3.png
water,"water type, medium-sized, deep blue, frog-like, smooth glossy skin with white spots, webbed feet and hands, large round orange eyes, streamlined body with a thin dorsal fin running from head to tail, three digits on each hand and foot",image_2/water/14_4.png
water,"Water type, medium-sized, dark blue, dolphin-like, sleek and smooth skin, white belly with gentle wave-like patterns, bright turquoise eyes, a dorsal fin shaped like a crescent moon, two flipper-like front limbs with light gray tips,",image_2/water/15_3.png
water,"water type, medium-sized, navy blue, dolphin-like, sleek body with white underbelly, streamlined dorsal fin, bright aqua eyes, elongated beak-like snout, two dorsal fins on its back, flipper-like limbs with webbed digits",image_2/water/16_1.png
water,"water type, medium-sized, deep blue, dolphin-like, sleek and smooth body with pale gray underbelly, large expressive eyes with a gentle gaze, streamlined dorsal fin, two flippers on each side with a curved shape, tail fin resembling a",image_2/water/17_4.png
water,"water type, medium-sized, navy blue, dolphin-like, smooth skin with a lighter blue underside, sparkling aqua eyes, two dorsal fins on its back, sleek fins with silver tips, playful expression, streamlined body for fast swimming.",image_2/water/18_5.png
water,"water type, medium-sized, sleek dark-blue body, dolphin-like with a smooth dorsal fin, shiny silver underbelly, bright aqua eyes, slender flippers, two thin antennae-like protrusions on top of its head, single crescent-shaped",image_2/water/19_3.png
water,"water type, medium-sized, dark blue, dolphin-like, smooth streamlined body with white patterns, glowing aqua-blue eyes, small fin-like ears, sleek dorsal fin on its back, flipper-like limbs with two digits.",image_2/water/20_1.png
water,"Water type, medium-sized, dark blue, dolphin-like, sleek streamlined body with a glossy finish, finned tail with lighter blue tips, oval-shaped eyes with a hint of silver, dorsal fin on its back, two small pectoral fins on",image_2/water/21_3.png
water,"water type, medium-sized, navy blue, dolphin-like, smooth skin with bright white underbelly, sleek streamlined body, small round eyes, fin-like appendages on its forelimbs, forked tail with flowing tips, two small dorsal fins",image_2/water/22_5.png
water,"water type, medium-sized, navy blue, dolphin-like, sleek streamlined body with silver accents, dorsal fin with a pearlescent sheen, gentle aqua-colored eyes, slender flippers adorned with fin-like edges, a split tail fin that resembles a wave",image_2/water/23_2.png
water,"Water type, medium-sized, dark blue, dolphin-like, smooth skin with a lighter blue underbelly, bright aqua eyes, streamlined body with a sleek dorsal fin, short flippers with two rounded digits on each, a crescent-shaped tail fin",image_2/water/24_1.png
water,"water type, large, dark-blue, shark-like body with a streamlined shape, white underbelly, fierce red eyes, long dorsal fin with jagged edges, sharp pointed pectoral fins, powerful tail fin with a crescent shape, two",image_2/water/25_3.png
water,"water type, medium-sized, navy-blue, dolphin-like, sleek body with lighter underbelly, bright turquoise eyes, fin-like appendages on its back, long streamlined tail with a crescent-shaped fin, webbed digits on each limb.",image_2/water/26_4.png
water,"water type, sleek, navy blue, dolphin-like, smooth silvery underbelly, bright pink eyes, streamlined body with a fin along its back, flipper-like limbs with two pointed digits, small fan-shaped tail at the end.",image_2/water/27_3.png
water,"Water type, medium-sized, sleek, mermaid-like, shimmering scales in shades of teal and aqua, long flowing tail with iridescent fins, graceful flippers with webbed fingers, serene azure eyes, delicate coral-colored crest on its head,",image_2/water/28_3.png
water,"Water type, medium-sized, navy blue, dolphin-like, smooth sleek body with a white underbelly, sparkling silver fins, bright turquoise eyes, long elegant tail with a crescent-shaped fin, two small pointed fins on its back.",image_2/water/29_5.png
water,"Water type, medium-sized, navy blue, dolphin-like, sleek streamlined body with silver patterns along its sides, large sparkling turquoise eyes, long flowing dorsal fin, two pectoral fins and a prominent tail fin, two tiny round ears on top of",image_2/water/30_3.png
grass,"grass type, medium-sized, bright-green quadruped, long vines extending from its back, yellow eyes, three-toed feet with sharp claws, leafy crest on its forehead, light-green spots scattered across its body.",image_2/grass/1_5.png
grass,"grass type, medium-sized, dark-green biped, broad leafy cloak draped over shoulders, sharp yellow eyes, thick woody antlers adorned with flowering vines, sturdy three-toed feet, small plant-like crest on forehead.",image_2/grass/2_3.png
grass,"Grass type, medium-sized, vibrant green biped, long vines extending from arms, round blue eyes, three-leaf clover on top of head, two sharp leaf blades protruding from elbows.",image_2/grass/3_3.png
grass,"grass type, small, lime-green reptilian creature, wide frilled leaf collar around neck, bright yellow eyes with slit pupils, tiny claws on each limb, short tail tipped with a budding flower, dark-green stripes along its back.",image_2/grass/4_1.png
grass,"tall and slender, grass type, bright-yellow petals resembling a sunhat, green leafy arms with frond-like fingers, cheerful expression with small eyes and a wide smile, sturdy bark-like legs with leafy sandals, textured vine tail trailing behind, covered",image_2/grass/5_3.png
grass,"grass type, medium, bright green biped, broad leafy tail, yellow eyes, two vine-like appendages extending from shoulders, slender body covered in small dark green spots, wide flat feet with three toes.",image_2/grass/6_4.png
grass,"Entry example: grass type, slim, emerald-green biped, two large leaves on its back forming a wing-like shape, bright yellow eyes, sleek body with a long vine tail, small brown buds around its ankles.",image_2/grass/7_3.png
grass,"grass type, medium-sized, bright green bipedal, long leafy arms with thorn-like extensions, glowing yellow eyes, broad smile, sturdy legs with three-toed feet, vibrant flowers blooming along its shoulders.",image_2/grass/8_2.png
grass,"large, grass type, vibrant-green bipedal, wide leafy wings that extend from its back, bright yellow eyes, long vine-like arms with three-fingered hands, sturdy trunk-like legs, large blossom at the top of its head.",image_2/grass/9_1.png
grass,"Grass type, medium-sized, vibrant green bipedal, wide leaves fanning out from its back forming a cape-like appearance, bright yellow eyes, a small flower blooming on its forehead, two long vines extending from each arm, with tiny green th",image_2/grass/10_2.png
grass,"grass type, medium-sized, bright green serpentine, long vine-like appendages extending from back, vibrant yellow underbelly, sleek head with elongated snout, elegant leaf crest on tail, sparkling emerald eyes.",image_2/grass/11_2.png
grass,"grass type, medium-sized, light-green bipedal, broad leaves draping from arms, bright yellow eyes, two-toed feet with small claws, a ring of tiny flowers encircling its neck, a pointed crest on its head.",image_2/grass/12_3.png
grass,"grass type, medium-sized, bright-green quadruped, wide leafy fronds extending from its back, deep blue eyes, two claws on each sturdy leg, thick vine-like tendrils wrapping around its limbs.",image_2/grass/13_4.png
grass,"grass type, medium-sized, bright-green quadruped, vine-like tendrils extending from its back, round yellow eyes, two small leaves on each leg, light-brown spots scattered across its body.",image_2/grass/14_2.png
grass,"grass type, medium-sized, dark-green biped, leafy vines extending from arms, bright yellow eyes, two clawed toes on each foot, vibrant purple petals forming a collar around its neck.",image_2/grass/15_4.png
grass,"grass type, medium-sized, bright-green biped, two long leaves extending from its arms, small yellow eyes, round purple berries hanging from its waist, long slender legs with brown roots for feet.",image_2/grass/16_3.png
grass,"woodland-themed grass type, slim and elegant, deep emerald bipedal creature, long vine-like arms extending from shoulders, vivid yellow petals encircling its slender neck, large expressive blue eyes, leaf-patterned markings scattered across its body, delicate",image_2/grass/17_4.png
grass,"vine-like grass type, medium-sized, emerald-green quadruped, flexible tendrils extending from back, bright yellow eyes, stubby legs with two leaf-shaped toes, spiraling pattern along its spine.",image_2/grass/18_1.png
grass,"grass type, medium-sized, light-green biped, broad leafy crest on its head, bright yellow eyes, long vine-like arms ending in fern-like fronds, sturdy trunk-like legs, swirling patterns of darker green on its back.",image_2/grass/19_1.png
grass,"vine-covered, bright-green quadruped, long tendrils extending from back, vivid yellow eyes, wide flat feet with three stubby toes on each leg, small clusters of berries hanging under chin.",image_2/grass/20_4.png
grass,"grass type, medium-sized, bright-green bipedal creature, broad leafy fronds as arms, sparkling yellow eyes, vines wrapped around its torso, two small antennae with flower buds on its head, sturdy roots as feet.",image_2/grass/21_3.png
